idade,nome,doses,doencas
99,Hepatite B recombinante (HB),3 doses, de acordo com histórico vacinal,
99,Difteria e tétano (dT),Iniciar ou completar três doses, de acordo com situação vacinal Reforço a cada 10 anos, ou a cada 5 anos em caso de ferimentos graves ou se contatos de difteria,
99,Febre amarela (VFA - atenuada),Dose única caso não tenha recebido nenhuma dose até os 5 anos Reforçar, caso a pessoa tenha recebido uma dose da vacina antes de completar 5 anos de idade,
45,HPV papilomavírus humano 6, 11, 16, 18 (HPV4 recombinante),Recomendada para homens e mulheres vítimas de violência sexual, na faixa etária de 15 a 45 anos de idade, em um esquema de 03 doses (sendo a 2a dose, 2 meses após a 1a dose; e a 3a dose, 6 meses após a 1a dose).,
29,Tríplice viral,Duas doses Verificar situação vacinal anterior,
59,Tríplice viral,Uma dose Verificar situação vacinal anterior,
18,Difteria, tétano e Pertussis (dTpa - acelular),Uma dose Reforço a cada 10 anos ou 5 anos em caso de ferimentos graves,
60,Hepatite B recombinante (HB),3 doses, de acordo com histórico vacinal,
60,Difteria e Tétano (dT),3 doses, de acordo com histórico vacinal Reforço a cada 10 anos ou a cada 5 anos em caso de ferimentos graves,
60,Febre amarela (VFA - atenuada),Uma dose,
60,Difteria, tétano e Pertussis (dTpa - acelular),Uma dose Reforço a cada 10 anos ou 5 anos em caso de ferimentos graves,
